<?xml version="1.0" encoding="utf-8" ?> 
<xsd:schema xmlns:xsd="http://www.w3.org/2001/XMLSchema">
    <xsd:element name="productlist">
        <xsd:complexType>
            <xsd:sequence>
                <xsd:element name="product" maxOccurs="unbounded">
                    <xsd:complexType>
                        <xsd:all>
                            <xsd:element name="name">
                                <xsd:complexType mixed="true">
                                    <xsd:attribute name="instock" type="xsd:boolean"></xsd:attribute>
                                </xsd:complexType>
                            </xsd:element>
                            <xsd:element name="price">
                                <xsd:simpleType>
                                    <xsd:restriction base="xsd:string">
                                        <xsd:pattern value="\d+\.\d{1,2}"></xsd:pattern>
                                    </xsd:restriction>
                                </xsd:simpleType>
                            </xsd:element>
                        </xsd:all>
                    </xsd:complexType>
                </xsd:element>
            </xsd:sequence>
        </xsd:complexType>
    </xsd:element>
</xsd:schema>